{
  "schema_version": 3,
  "chapter_id": "S05",
  "seconds": 75,
  "video": {
    "width": 1920,
    "height": 1080,
    "fps": 30
  },
  "shots_manifest": "assets/productions/v10-master-draft-20261009/shots-manifest.json",
  "timeline": [
    {
      "shot": "S05_01",
      "take_from_seconds": 0,
      "duration_seconds": 8.0,
      "timeline_start_seconds": 0.0
    },
    {
      "shot": "S05_02",
      "take_from_seconds": 0,
      "duration_seconds": 6.0,
      "timeline_start_seconds": 8.0
    },
    {
      "shot": "S05_03",
      "take_from_seconds": 0,
      "duration_seconds": 16.0,
      "timeline_start_seconds": 14.0
    },
    {
      "shot": "S05_04",
      "take_from_seconds": 0,
      "duration_seconds": 8.0,
      "timeline_start_seconds": 30.0
    },
    {
      "shot": "S05_05",
      "take_from_seconds": 0,
      "duration_seconds": 7.0,
      "timeline_start_seconds": 38.0
    },
    {
      "shot": "S05_06",
      "take_from_seconds": 0,
      "duration_seconds": 13.0,
      "timeline_start_seconds": 45.0
    },
    {
      "shot": "S05_07",
      "take_from_seconds": 0,
      "duration_seconds": 10.0,
      "timeline_start_seconds": 58.0
    },
    {
      "shot": "S05_08",
      "take_from_seconds": 0,
      "duration_seconds": 7.0,
      "timeline_start_seconds": 68.0
    }
  ],
  "visual_overlays": [
    {
      "kind": "image",
      "start_seconds": 0,
      "end_seconds": 6,
      "x": 0,
      "y": 0,
      "width": 1920,
      "height": 1080,
      "fit": "stretch",
      "source": "assets/graphics/v10/5a6f27534df4-group.png",
      "sha256": "5a6f27534df46a78decbf4645717c758365f49447de7b51b2835ea4feedf913f"
    },
    {
      "kind": "image",
      "start_seconds": 6,
      "end_seconds": 12,
      "x": 0,
      "y": 0,
      "width": 1920,
      "height": 1080,
      "fit": "stretch",
      "source": "assets/graphics/v10/ac6fd39a5b34-statement.png",
      "sha256": "ac6fd39a5b342f88ab2413eedd7a647e877505acd067f016e84b0f656875c48a"
    },
    {
      "kind": "image",
      "start_seconds": 59,
      "end_seconds": 65,
      "x": 0,
      "y": 0,
      "width": 1920,
      "height": 1080,
      "fit": "stretch",
      "source": "assets/graphics/v10/61a098bb99e4-comments.png",
      "sha256": "61a098bb99e43b278ff51c79d84b2c0f2b295f7a68f1b3201d79fbb2d6bb2138"
    },
    {
      "kind": "image",
      "start_seconds": 65,
      "end_seconds": 69,
      "x": 0,
      "y": 0,
      "width": 1920,
      "height": 1080,
      "fit": "stretch",
      "source": "assets/graphics/v10/8422af8a79f2-poster.png",
      "sha256": "8422af8a79f2acaf11f22860400b8f56ba86faa48e7ccc65777ab735f0f229c3"
    },
    {
      "kind": "image",
      "start_seconds": 69,
      "end_seconds": 72,
      "x": 0,
      "y": 0,
      "width": 1920,
      "height": 1080,
      "fit": "stretch",
      "source": "assets/graphics/v10/0ac3eeaca0e1-new-headline.png",
      "sha256": "0ac3eeaca0e1d4093479a43905909a76d9577931eb2b5099b0ac09e54b431ea6"
    },
    {
      "kind": "image",
      "start_seconds": 72,
      "end_seconds": 75,
      "x": 0,
      "y": 0,
      "width": 1920,
      "height": 1080,
      "fit": "stretch",
      "source": "assets/graphics/v10/0e0c2c93e989-account.png",
      "sha256": "0e0c2c93e9893372da64fbd7015f18e5afa8ae75036a7575e993e9292bc32b2f"
    },
    {
      "kind": "video",
      "start_seconds": 18,
      "end_seconds": 48,
      "x": 0,
      "y": 0,
      "width": 1920,
      "height": 1080,
      "fit": "stretch",
      "take_from_seconds": 0.2,
      "speed": 1,
      "shot": "SH_full"
    },
    {
      "kind": "video",
      "start_seconds": 48,
      "end_seconds": 55,
      "x": 0,
      "y": 0,
      "width": 1920,
      "height": 1080,
      "fit": "stretch",
      "take_from_seconds": 3,
      "speed": 1,
      "shot": "SH_full"
    }
  ],
  "audio_clips": [
    {
      "source": "assets/renders/s05-story-native1080-clean-75s-v2.mp4",
      "sha256": "40cdd36903810f42c0b009bcab807060af582327704c45d3504b55e3b4d42d23",
      "take_from_seconds": 0,
      "duration_seconds": 75,
      "timeline_start_seconds": 0
    }
  ],
  "variants": {
    "clean": {
      "ass_overlays": [
        {
          "path": "assets/graphics/v10/e8fab1ad0e6e-s05-native1080-clean.ass",
          "sha256": "e8fab1ad0e6e8e07ab3da8e393636341457895155bfed8cf9330a1f59901dd40"
        }
      ]
    },
    "subtitles": {
      "ass_overlays": [
        {
          "path": "assets/graphics/v10/e8fab1ad0e6e-s05-native1080-clean.ass",
          "sha256": "e8fab1ad0e6e8e07ab3da8e393636341457895155bfed8cf9330a1f59901dd40"
        },
        {
          "path": "assets/graphics/v10/ede668ba5f1c-s05-native1080.ass",
          "sha256": "ede668ba5f1cce9bf4d6eb9d5b0c483e773ba8baf3884ee38a35e4c28943e20d"
        }
      ]
    }
  },
  "outputs": {
    "clean": "assets/renders/v10-master-draft-s05-clean-v1.mp4",
    "subtitles": "assets/renders/v10-master-draft-s05-subtitles-v1.mp4",
    "manifest": "assets/productions/v10-master-draft-20261009/s05-review-manifest.json"
  },
  "notes": "v10 draft reconstruction; imported pilot shots remain frozen until separately registered"
}
