{
  "schema_version": 3,
  "chapter_id": "credits",
  "seconds": 15,
  "video": {
    "width": 1920,
    "height": 1080,
    "fps": 30
  },
  "shots_manifest": "assets/productions/v10-master-draft-20261009/shots-manifest.json",
  "timeline": [
    {
      "clip": {
        "path": "assets/renders/credits-native1080-review-15s-v1.mp4",
        "sha256": "0eac49d7ea35d66d6d19bf92aa507413519409f14d13c4540fcb6b05b42ffb7b"
      },
      "take_from_seconds": 0,
      "duration_seconds": 15,
      "timeline_start_seconds": 0
    }
  ],
  "variants": {
    "clean": {
      "ass_overlays": [
        {
          "path": "assets/graphics/v10/d57a738ea681-empty.ass",
          "sha256": "d57a738ea681e7bd5ecc6c7e60889c269b44fa0d95262b4e53e06871322ed9b6"
        }
      ]
    },
    "subtitles": {
      "ass_overlays": [
        {
          "path": "assets/graphics/v10/d57a738ea681-empty.ass",
          "sha256": "d57a738ea681e7bd5ecc6c7e60889c269b44fa0d95262b4e53e06871322ed9b6"
        }
      ]
    }
  },
  "outputs": {
    "clean": "assets/renders/v10-master-draft-credits-clean-v1.mp4",
    "subtitles": "assets/renders/v10-master-draft-credits-subtitles-v1.mp4",
    "manifest": "assets/productions/v10-master-draft-20261009/credits-review-manifest.json"
  }
}
