{
  "schema_version": 3,
  "chapter_id": "S07",
  "seconds": 65,
  "video": {
    "width": 1920,
    "height": 1080,
    "fps": 30
  },
  "shots_manifest": "assets/productions/v10-master-draft-20261009/shots-manifest.json",
  "timeline": [
    {
      "shot": "S07_01",
      "take_from_seconds": 0,
      "duration_seconds": 8.0,
      "timeline_start_seconds": 0.0
    },
    {
      "shot": "S07_02",
      "take_from_seconds": 0,
      "duration_seconds": 10.0,
      "timeline_start_seconds": 8.0
    },
    {
      "shot": "S07_03",
      "take_from_seconds": 0,
      "duration_seconds": 11.0,
      "timeline_start_seconds": 18.0
    },
    {
      "shot": "S07_04",
      "take_from_seconds": 0,
      "duration_seconds": 11.0,
      "timeline_start_seconds": 29.0
    },
    {
      "shot": "S07_05",
      "take_from_seconds": 0,
      "duration_seconds": 9.0,
      "timeline_start_seconds": 40.0
    },
    {
      "shot": "S07_06",
      "take_from_seconds": 0,
      "duration_seconds": 9.0,
      "timeline_start_seconds": 49.0
    },
    {
      "shot": "S07_07",
      "take_from_seconds": 0,
      "duration_seconds": 7.0,
      "timeline_start_seconds": 58.0
    }
  ],
  "visual_overlays": [
    {
      "kind": "image",
      "start_seconds": 8,
      "end_seconds": 11,
      "x": 0,
      "y": 0,
      "width": 1920,
      "height": 1080,
      "fit": "stretch",
      "source": "assets/graphics/v10/7d4e0e8758f3-edit-before.png",
      "sha256": "7d4e0e8758f31b360e57aa2a64db8b85d9afe8f818895935f4b79a7235378f7b"
    },
    {
      "kind": "image",
      "start_seconds": 11,
      "end_seconds": 14,
      "x": 0,
      "y": 0,
      "width": 1920,
      "height": 1080,
      "fit": "stretch",
      "source": "assets/graphics/v10/22fede44a7b0-edit-after.png",
      "sha256": "22fede44a7b0534ce68c75ae90c9d96b39ec66cc41284c583a6d2dd7aa091368"
    },
    {
      "kind": "image",
      "start_seconds": 14,
      "end_seconds": 19,
      "x": 0,
      "y": 0,
      "width": 1920,
      "height": 1080,
      "fit": "stretch",
      "source": "assets/graphics/v10/0b1c2714f7d1-correction.png",
      "sha256": "0b1c2714f7d17d88af7341cfddb3538b9dd79f2b4783ab7d32122360490e4718"
    },
    {
      "kind": "image",
      "start_seconds": 19,
      "end_seconds": 23,
      "x": 0,
      "y": 0,
      "width": 1920,
      "height": 1080,
      "fit": "stretch",
      "source": "assets/graphics/v10/cdc319e618f2-reply.png",
      "sha256": "cdc319e618f2b3a3563b77743c8c0d04db5caf875563abd0c8dc02fcfc75412d"
    },
    {
      "kind": "image",
      "start_seconds": 23,
      "end_seconds": 27,
      "x": 0,
      "y": 0,
      "width": 1920,
      "height": 1080,
      "fit": "stretch",
      "source": "assets/graphics/v10/6e6920c8c2a5-draft.png",
      "sha256": "6e6920c8c2a54b163d4bb544464ca4086b0778479526368b60ab9d3fadc5b310"
    },
    {
      "kind": "image",
      "start_seconds": 27,
      "end_seconds": 31,
      "x": 0,
      "y": 0,
      "width": 1920,
      "height": 1080,
      "fit": "stretch",
      "source": "assets/graphics/v10/355cee2b18d9-sent.png",
      "sha256": "355cee2b18d989fac0aeeff7ae2359b1c8b062dedf0269d7b646d58ba695707b"
    },
    {
      "kind": "image",
      "start_seconds": 31,
      "end_seconds": 34,
      "x": 0,
      "y": 0,
      "width": 1920,
      "height": 1080,
      "fit": "stretch",
      "source": "assets/graphics/v10/229cab4a048f-topics.png",
      "sha256": "229cab4a048ff5660ae4fa8c8e75392e705bb1834575d19c745c5ccebffb6415"
    },
    {
      "kind": "image",
      "start_seconds": 36,
      "end_seconds": 40,
      "x": 0,
      "y": 0,
      "width": 1920,
      "height": 1080,
      "fit": "stretch",
      "source": "assets/graphics/v10/3477bde8e731-other-delete.png",
      "sha256": "3477bde8e73130b50f1bc20c4be5384e28b2ee76b8ffe138e68e181d0753453e"
    },
    {
      "kind": "image",
      "start_seconds": 40,
      "end_seconds": 44,
      "x": 0,
      "y": 0,
      "width": 1920,
      "height": 1080,
      "fit": "stretch",
      "source": "assets/graphics/v10/552ac4ab438b-return-work.png",
      "sha256": "552ac4ab438b33aa801ad9eb1f548fa8c6ff4417fd46683bfe7e4b32b9df997a"
    },
    {
      "kind": "image",
      "start_seconds": 55,
      "end_seconds": 58,
      "x": 0,
      "y": 0,
      "width": 1920,
      "height": 1080,
      "fit": "stretch",
      "source": "assets/graphics/v10/3912f2b401e9-wife-first.png",
      "sha256": "3912f2b401e9b1a299aa5d3659a226e1750ab90dac6ae3b32c76efd3a82062a7"
    },
    {
      "kind": "image",
      "start_seconds": 58,
      "end_seconds": 61,
      "x": 0,
      "y": 0,
      "width": 1920,
      "height": 1080,
      "fit": "stretch",
      "source": "assets/graphics/v10/6b190fedd8d4-wife-again.png",
      "sha256": "6b190fedd8d462666387d63ff1e838195a79b2d4f2f5be323868a5a422af5cf2"
    },
    {
      "kind": "image",
      "start_seconds": 61,
      "end_seconds": 62.7,
      "x": 0,
      "y": 0,
      "width": 1920,
      "height": 1080,
      "fit": "stretch",
      "source": "assets/graphics/v10/cc5f383a6b2a-unknown-call.png",
      "sha256": "cc5f383a6b2a8c4feac7ae527fee807a7cfa1e87227501dbf4244ca250ac8fc4"
    },
    {
      "kind": "video",
      "start_seconds": 46,
      "end_seconds": 54,
      "x": 0,
      "y": 0,
      "width": 1920,
      "height": 1080,
      "fit": "stretch",
      "take_from_seconds": 1,
      "speed": 1,
      "shot": "S07_packing"
    },
    {
      "kind": "image",
      "start_seconds": 0,
      "end_seconds": 0.2,
      "x": 0,
      "y": 0,
      "width": 1920,
      "height": 1080,
      "fit": "stretch",
      "source": "assets/graphics/v10/ec60e5394e47-final-s07-opening.png",
      "sha256": "ec60e5394e4770c9e49d14872a3e8a5f0a21644dbc4b0098f5bbe41b4b757893"
    }
  ],
  "audio_clips": [
    {
      "source": "assets/renders/s07-story-native1080-clean-65s-v4.mp4",
      "sha256": "fca75b61713bccd7c145ca758a848661f38e56cdedbd50350dd08ba6be854ac8",
      "take_from_seconds": 0,
      "duration_seconds": 65,
      "timeline_start_seconds": 0
    }
  ],
  "variants": {
    "clean": {
      "ass_overlays": [
        {
          "path": "assets/graphics/v10/1e5161a36b01-s07-native1080-clean.ass",
          "sha256": "1e5161a36b01eaea81e7c7779df179a2992df88489db4a7fd39765412b15b38a"
        }
      ]
    },
    "subtitles": {
      "ass_overlays": [
        {
          "path": "assets/graphics/v10/1e5161a36b01-s07-native1080-clean.ass",
          "sha256": "1e5161a36b01eaea81e7c7779df179a2992df88489db4a7fd39765412b15b38a"
        },
        {
          "path": "assets/graphics/v10/d55cda69140b-s07-native1080.ass",
          "sha256": "d55cda69140ba06e050d111ab65a4d7cdf863a20bac8023dc7abfaa87d6fcc88"
        }
      ]
    }
  },
  "outputs": {
    "clean": "assets/renders/v10-master-draft-s07-clean-v1.mp4",
    "subtitles": "assets/renders/v10-master-draft-s07-subtitles-v1.mp4",
    "manifest": "assets/productions/v10-master-draft-20261009/s07-review-manifest.json"
  },
  "notes": "v10 draft reconstruction; imported pilot shots remain frozen until separately registered"
}
