{
  "schema_version": 3,
  "chapter_id": "S06",
  "seconds": 100,
  "video": {
    "width": 1920,
    "height": 1080,
    "fps": 30
  },
  "shots_manifest": "assets/productions/v10-master-draft-20261009/shots-manifest.json",
  "timeline": [
    {
      "shot": "S06_01",
      "take_from_seconds": 0,
      "duration_seconds": 20.0,
      "timeline_start_seconds": 0.0
    },
    {
      "shot": "S06_02",
      "take_from_seconds": 0,
      "duration_seconds": 3.0,
      "timeline_start_seconds": 20.0
    },
    {
      "shot": "S06_03",
      "take_from_seconds": 0,
      "duration_seconds": 4.0,
      "timeline_start_seconds": 23.0
    },
    {
      "shot": "S06_04",
      "take_from_seconds": 0,
      "duration_seconds": 5.0,
      "timeline_start_seconds": 27.0
    },
    {
      "shot": "S06_05",
      "take_from_seconds": 0,
      "duration_seconds": 5.0,
      "timeline_start_seconds": 32.0
    },
    {
      "shot": "S06_06",
      "take_from_seconds": 0,
      "duration_seconds": 3.0,
      "timeline_start_seconds": 37.0
    },
    {
      "shot": "S06_07",
      "take_from_seconds": 0,
      "duration_seconds": 4.0,
      "timeline_start_seconds": 40.0
    },
    {
      "shot": "S06_08",
      "take_from_seconds": 0,
      "duration_seconds": 4.0,
      "timeline_start_seconds": 44.0
    },
    {
      "shot": "S06_09",
      "take_from_seconds": 0,
      "duration_seconds": 2.0,
      "timeline_start_seconds": 48.0
    },
    {
      "shot": "S06_10",
      "take_from_seconds": 0,
      "duration_seconds": 7.0,
      "timeline_start_seconds": 50.0
    },
    {
      "shot": "S06_11",
      "take_from_seconds": 0,
      "duration_seconds": 6.0,
      "timeline_start_seconds": 57.0
    },
    {
      "shot": "S06_12",
      "take_from_seconds": 0,
      "duration_seconds": 8.0,
      "timeline_start_seconds": 63.0
    },
    {
      "shot": "S06_13",
      "take_from_seconds": 0,
      "duration_seconds": 2.0,
      "timeline_start_seconds": 71.0
    },
    {
      "shot": "S06_14",
      "take_from_seconds": 0,
      "duration_seconds": 3.0,
      "timeline_start_seconds": 73.0
    },
    {
      "shot": "S06_15",
      "take_from_seconds": 0,
      "duration_seconds": 4.0,
      "timeline_start_seconds": 76.0
    },
    {
      "shot": "S06_16",
      "take_from_seconds": 0,
      "duration_seconds": 7.0,
      "timeline_start_seconds": 80.0
    },
    {
      "shot": "S06_17",
      "take_from_seconds": 0,
      "duration_seconds": 3.0,
      "timeline_start_seconds": 87.0
    },
    {
      "shot": "S06_18",
      "take_from_seconds": 0,
      "duration_seconds": 5.0,
      "timeline_start_seconds": 90.0
    },
    {
      "shot": "S06_19",
      "take_from_seconds": 0,
      "duration_seconds": 5.0,
      "timeline_start_seconds": 95.0
    }
  ],
  "visual_overlays": [
    {
      "kind": "image",
      "start_seconds": 95,
      "end_seconds": 98,
      "x": 0,
      "y": 0,
      "width": 1920,
      "height": 1080,
      "fit": "stretch",
      "source": "assets/graphics/v10/1a3dccae1096-a-comment-native1080.png",
      "sha256": "1a3dccae109634c4441275f00a54eef3e2051cc154e39cfa99bb01f4cb1f51ab"
    },
    {
      "kind": "video",
      "start_seconds": 0,
      "end_seconds": 5,
      "x": 0,
      "y": 0,
      "width": 1920,
      "height": 1080,
      "fit": "contain_black",
      "take_from_seconds": 0,
      "speed": 1,
      "shot": "SH_phone"
    },
    {
      "kind": "video",
      "start_seconds": 5,
      "end_seconds": 15,
      "x": 0,
      "y": 0,
      "width": 1920,
      "height": 1080,
      "fit": "stretch",
      "take_from_seconds": 3,
      "speed": 1,
      "shot": "SH_full"
    }
  ],
  "audio_clips": [
    {
      "source": "assets/renders/s06-story-native1080-clean-100s-v3.mp4",
      "sha256": "26b36f9afb9034ea58f364ea4d6aa9776444b4a66a8921c2b0a0bf10b7d68213",
      "take_from_seconds": 0,
      "duration_seconds": 100,
      "timeline_start_seconds": 0
    }
  ],
  "variants": {
    "clean": {
      "ass_overlays": [
        {
          "path": "assets/graphics/v10/7c581a9c5fa5-s06-native1080-clean.ass",
          "sha256": "7c581a9c5fa54da47b02f7c7a41b0f5654234ee8576d956fcc95da4d86d9b174"
        }
      ]
    },
    "subtitles": {
      "ass_overlays": [
        {
          "path": "assets/graphics/v10/7c581a9c5fa5-s06-native1080-clean.ass",
          "sha256": "7c581a9c5fa54da47b02f7c7a41b0f5654234ee8576d956fcc95da4d86d9b174"
        },
        {
          "path": "assets/graphics/v10/7323372cbcff-s06-native1080-dialogue.ass",
          "sha256": "7323372cbcff98fd942faedbe07f74bb0dd3e8988a561449a6ffa4ccb0aa1cbb"
        }
      ]
    }
  },
  "outputs": {
    "clean": "assets/renders/v10-master-draft-s06-clean-v1.mp4",
    "subtitles": "assets/renders/v10-master-draft-s06-subtitles-v1.mp4",
    "manifest": "assets/productions/v10-master-draft-20261009/s06-review-manifest.json"
  },
  "notes": "v10 draft reconstruction; imported pilot shots remain frozen until separately registered"
}
